{
  "schema_version": "1.0",
  "artifact_type": "render_task",
  "task_id": "visual-theo-waldhart-canonical-v2",
  "source_brief": "visual-bible/characters/theo-waldhart.json",
  "source_hash": "2d6b5c798b54bad12ffea4955ffc9ce493ea5e4c0fceb54f4b8cc4d6ff196a53",
  "template_id": "character-reference-sheet-v1",
  "provider": "codex",
  "operation": "generate",
  "prompt": "Create a clean canonical reference sheet for one original webtoon character.\nTemplate: character-reference-sheet-v1. Create the first canonical identity sheet for an original webtoon character.\nAsset ID: theo-waldhart-canonical-v2.\nLayout: 같은 비율의 전신 정면·좌측면·후면을 중앙에 나란히 두고, 하단에 네 가지 표정과 장부·가문 장식·곡물 주머니 디테일을 작은 칸으로 배치한 중립 캐릭터 시트.\nRequired views: 정면 전신, 단정한 남작가 평상복, 좌측면 전신, 장부를 든 자세, 후면 전신, 튜닉 재단과 머리 실루엣 확인, 표정: 진지함, 장부 계산 중, 형에게 투덜거림, 안도한 미소, 소품: 작은 장부, 곡물 주머니, 은빛 가문 장식.\nSheet background: 옅은 아이보리 회색의 비장식적 스튜디오 배경, 정면에서 고르게 비추는 중립 조명과 발밑의 아주 옅은 그림자만 둔다.. Labels: none.\nPreserve exactly: 테오 발트하르트는 일곱 살의 또래보다 약간 작은 남작가 차남이다., 둥근 어린 얼굴, 유난히 진지한 회색 눈, 생각할 때 살짝 찌푸리는 미간., 부드럽게 흩어지는 짙은 밤색 단발머리와 짧은 앞머리., 가죽끈으로 묶은 작은 장부, 곡물 알갱이 주머니, 왼쪽 가슴에 단 은빛 발트하르트 가문 장식., 깨끗하고 몸에 맞는 청회색 모직 튜닉, 흐린 은회색 린넨 셔츠, 짙은 파란 가문 장식선, 잘 손질한 갈색 가죽 신발., 팔레트는 깊은 청회색, 관리된 황갈색 가죽, 흙빛 갈색, 흐린 은회색을 중심으로 한다., 정제된 중세 판타지 웹툰 일러스트, 섬세한 선화와 부드러운 디지털 채색, 과장되지 않은 색면 분리..\nReferences: none; establish an original design from the declared visual canon.\nStandard sheet invariants: same face geometry, hairstyle, body proportion, outfit construction, and palette in every view, unobstructed silhouette and complete limbs, plain neutral background with generous separation.\nPalette swatches: #28384a, #d9c59a, #8e5f3d, #b9c7c9.\nAvoid: 성인 또는 십대 체형, 금발 또는 밝은 머리색, 마법사 지팡이, 마법 주문, 현대 물품, 망토, 후드, 해진 옷, 누더기, 지나치게 가난해 보이는 의상, 과장된 근육, 노출 의상, 갑옷 중심의 의상, 읽을 수 있는 글자, 말풍선, 워터마크, 서명, 참고 이미지의 인물·의상·구도 복제, dramatic scene composition, perspective distortion, cropped feet, duplicate views, readable text, watermark, signature.",
  "references": [],
  "request": {
    "size": "2048x2048",
    "quality": "high",
    "format": "png"
  },
  "output": {
    "path": "visual-bible/characters/theo-waldhart-canonical-v2.png",
    "result_metadata_path": "visual-bible/characters/theo-waldhart-canonical-v2.result.json"
  }
}
