{
  "schema_version": "1.0",
  "artifact_type": "render_task",
  "task_id": "ep001-shot-024",
  "source_brief": "episodes/ep001/briefs/shot-024.json",
  "source_hash": "a2123a096b7b78c92408515d174a40128045b93ddfb72f8962fb773c8aefe2b3",
  "template_id": "webtoon-shot-v1",
  "provider": "codex",
  "operation": "edit",
  "prompt": "Create one finished original vertical-scroll webtoon art shot. Template: webtoon-shot-v1.\nPurpose: 카일의 장난스러운 먹거리 권유가 테오의 조용한 관찰로 옮겨가며, 가족 식사의 가벼운 호흡을 다음 시선 전환까지 자연스럽게 잇는다.\nCanvas: 1536x3072 pixels; keep a 5% safe margin.\nComposition and camera: medium_close_up shot, eye_level angle, portrait lens feel, camera position 식탁 남쪽 모서리에서 형제의 손과 시선만 보이도록 낮게 붙는다, movement locked, focus on 치즈 접시를 미는 카일의 손에서 부스러기를 바라보는 테오의 손끝으로 옮겨가는 리듬. 가로 전체를 쓰는 두 개의 세로 적층 패널 사이에 얇고 깨끗한 흰 여백\nBridge composition: this single generated image contains exactly 2 connected full-width mini-panels stacked vertically, separated by clean gutters. Read them top-to-bottom as one continuous transition, not as duplicate variants of the same pose.\nCanvas rule: preserve the declared 1:2 tall composite canvas with 2 equal-height full-width panels. Do not collapse it into one undivided scene or a differently proportioned strip.\nBridge function: action_continuation. Ordered micro-beats: panel 1: 카일의 손이 치즈 접시를 테오 쪽으로 조금 더 밀고, 테오의 작은 손은 빵 부스러기 하나를 조심스럽게 모은다.; panel 2: 테오는 치즈를 받으면서도 손끝의 부스러기를 잠시 내려다보고, 카일은 장난스러운 미소를 유지한다..\nSubjects:\n- theo-waldhart at left 12%, top 22%, width 38%, height 68%, midground; pose 두 패널 모두 식탁에 앉은 자세, 첫 패널은 손만 두드러지고 둘째 패널은 작은 옆얼굴이 함께 보인다; expression 가벼운 미소에서 잠깐의 생각으로 가라앉음; gaze 둘째 패널에서 손끝의 빵 부스러기; action 치즈를 받으면서 부스러기 하나를 정리한다. Preserve: 일곱 살의 작은 체격, 헝클어진 밤갈색 머리, 푸른 회색 튜닉과 은색 세 잎 문장, 성인 같은 손이나 체형 금지.\n- kyle-waldhart at left 54%, top 14%, width 34%, height 70%, midground; pose 식탁 너머에서 한 손으로 접시를 밀고, 둘째 패널에서는 테오를 향해 가볍게 기대어 앉는다; expression 천연덕스럽고 다정한 미소; gaze 테오; action 치즈 조각을 권한다. Preserve: 열네 살의 긴 팔다리, 붉은 갈색 머리, 문장 없는 푸른 조끼, 브로치와 망토 금지.\nBackground: location walt-fort-dining-hall; 월트 요새의 소박하지만 정돈된 나무 식탁을 같은 시점에서 두 개의 세로 미니 패널로 나눈다.. Use source crop left 18%, top 34%, width 64%, height 46%; perspective 상단 패널의 접시와 손이 하단 패널의 테오 시선으로 자연스럽게 이어지는 얕은 대각선; depth layers: 식탁 가장자리와 빵 부스러기, 형제의 손과 얼굴, 흐린 벽장과 벽난로; lighting 과장 없는 따뜻한 실내 저녁빛, 역광과 광선 효과 없음.\nVisual treatment: line 테오의 작은 손과 카일의 접시 움직임에만 또렷한 선을 주는 정제된 웹툰 선화; color 짙은 나무 갈색, 치즈의 따뜻한 베이지, 푸른 회색 의상의 절제된 대비; rendering 테오 기준 시트와 일치하는 부드러운 2D 디지털 채색; mood 형제의 장난이 조용한 관찰로 바뀌는 짧은 숨.\nReferences, in authoritative input order:\n- Image 1: character_identity; use only for that declared role.\n- Image 2: character_identity; use only for that declared role.\n- Image 3: background_space; use only for that declared role.\nContinuity: screen direction left_to_right; state entering: 카일이 테오에게 치즈를 권한 직후; state leaving: 테오의 손끝과 빵 부스러기에 시선이 머문다.\nLettering: generate no speech balloons, captions, or readable text.\nAvoid: speech bubbles, captions, readable text, watermark, signature, duplicate character, 망토, 브로치, 말풍선, 캡션, 읽을 수 있는 글자, 워터마크, 서명, 반복된 인물.",
  "references": [
    {
      "path": "visual-bible/characters/theo-waldhart-canonical-v4.png",
      "role": "character_identity",
      "index": 1
    },
    {
      "path": "visual-bible/characters/kyle-waldhart-canonical-v2.png",
      "role": "character_identity",
      "index": 2
    },
    {
      "path": "visual-bible/backgrounds/walt-fort-dining-hall-v1.png",
      "role": "background_space",
      "index": 3
    }
  ],
  "request": {
    "size": "1536x3072",
    "quality": "high",
    "format": "png"
  },
  "output": {
    "path": "episodes/ep001/art/shot-024.png",
    "result_metadata_path": "episodes/ep001/art/shot-024.result.json"
  }
}
