{
  "schema_version": "1.0",
  "artifact_type": "render_task",
  "task_id": "visual-waldhart-heraldry-v1",
  "source_brief": "visual-bible/props/waldhart-heraldry.json",
  "source_hash": "b1e785bb6b0bd44fd7489b84a71de96c3feb3b3fa45e83b5292dcbfbc9bfc7f8",
  "template_id": "prop-reference-sheet-v1",
  "provider": "codex",
  "operation": "edit",
  "prompt": "Create a clean canonical design sheet for one original webtoon prop.\nTemplate: prop-reference-sheet-v1. Create reusable design canon for one original webtoon prop.\nAsset ID: waldhart-heraldry-v1.\nLayout: 상단 중앙에 크게 놓인 정면 방패 문장, 하단에 같은 문장을 적용한 브로치·왁스 인장·자수 패치·작은 깃발을 균등한 칸으로 배치한 소품 기준 시트.\nRequired views: 정면 방패 문장: 청회색 방패와 은빛 새싹나무, 은빛 가슴 브로치 적용 예시, 푸른 왁스 인장 각인 예시, 청회색 천 자수 패치 예시, 짧은 깃발의 단색 문장 예시, 문양의 단순 실루엣 확대.\nSheet background: 옅은 아이보리 회색의 비장식적 스튜디오 배경, 정면의 균일한 중립 조명과 약한 접지 그림자만 둔다.. Labels: none.\nPreserve exactly: 발트하르트 남작가의 문장은 짙은 청회색 방패 안에 은빛 새싹나무를 둔 단순한 방패형 문장이다., 은빛 새싹나무는 하나의 곧은 줄기에 위쪽·왼쪽·오른쪽 잎이 하나씩 달린 세 잎 실루엣이며, 멀리서도 읽히는 굵고 간결한 형태를 유지한다., 방패 윤곽, 은빛 새싹나무, 청회색과 은색의 대비는 브로치·인장·자수·깃발에 공통으로 유지한다., 정제된 중세 판타지 웹툰 소품 시트, 섬세한 선화와 절제된 디지털 채색, 중립 스튜디오 조명..\nReferences, in authoritative input order:\n- Image 1: heraldry_reference; use only for that declared role.\nRequested change: produce only the declared new views while retaining the authoritative identity or spatial layout from the references.\nStandard sheet invariants: consistent dimensions, construction, materials, markings, and wear across every view, plain background and complete unobstructed silhouette.\nPalette swatches: #28384a, #b9c7c9, #4a4139, #e7e3dc.\nAvoid: 읽을 수 있는 표어, 문자, 숫자, 왕관, 금색 장식, 사자·용·새 등의 동물 문장, 복잡한 과장 장식, 현대 로고, 워터마크, 서명, 방패마다 다른 새싹나무 모양, changing mechanism between views, decorative scene composition, cropped object, readable text, watermark, signature.",
  "references": [
    {
      "path": "visual-bible/characters/theo-waldhart-canonical-v3.png",
      "role": "heraldry_reference",
      "index": 1
    }
  ],
  "request": {
    "size": "2048x2048",
    "quality": "high",
    "format": "png"
  },
  "output": {
    "path": "visual-bible/props/waldhart-heraldry-v1.png",
    "result_metadata_path": "visual-bible/props/waldhart-heraldry-v1.result.json"
  }
}
