{
  "schema_version": "1.0",
  "artifact_type": "render_task",
  "task_id": "ep001-shot-015",
  "source_brief": "episodes/ep001/briefs/shot-015.json",
  "source_hash": "0f13eb8af55cd080fbceaa3d7ca0e41f1ddc0b8774356851bcfbcbe906b84c5a",
  "template_id": "webtoon-shot-v1",
  "provider": "codex",
  "operation": "edit",
  "prompt": "Create one finished original vertical-scroll webtoon art shot. Template: webtoon-shot-v1.\nPurpose: 브람이 편지를 감추려는 미세한 동작과 낡은 인장을 통해 영지의 빚을 시각적으로 드러낸다.\nCanvas: 1536x2048 pixels; keep a 6% safe margin.\nComposition and camera: close_up shot, high angle, portrait lens feel, camera position 식탁 위 브람의 손과 테오 시선 사이, movement push_in, focus on 브람의 손에 든 낡은 봉인 편지와 굳은 손가락. 상단 왼쪽에 테오의 질문을 둘 여백을 남긴다\nSubjects:\n- bram-waldhart at left 46%, top 33%, width 42%, height 50%, foreground; pose 손과 숲색 소매만 크게 보인다; expression 얼굴은 프레임 밖; gaze 프레임 밖; action 편지를 들어 자신의 몸쪽으로 감춘다. Preserve: 중년의 단단한 손, 숲색 더블릿 소매, 장식적인 반지나 문장 없음.\n- theo-waldhart at left 4%, top 62%, width 22%, height 22%, foreground; pose 작은 손끝과 옆머리만 보인다; expression 얼굴 일부에 드러난 의문; gaze 편지; action 편지 가장자리를 따라 시선을 옮긴다. Preserve: 작은 손, 밤색 머리, 푸른 회색 소매.\nBackground: location walt-fort-dining-hall; 식탁 위 빵 조각과 수프 그릇 옆에 든, 글자는 전혀 읽히지 않는 낡은 봉인 편지. Use source crop left 25%, top 46%, width 56%, height 30%; perspective 편지 봉인이 중앙에 오도록 한 높은 근접 구도; depth layers: 테오의 손끝, 브람의 손과 편지, 식탁 위 음식; lighting 차분한 실내광, 봉인만 낮게 반사.\nVisual treatment: line 편지 가장자리와 손가락에 집중; color 바랜 종이·갈색·짙은 숲색; rendering 읽을 수 없는 문서 재질을 가진 2D 클로즈업; mood 감추고 싶은 무게.\nReferences, in authoritative input order:\n- Image 1: character_identity; use only for that declared role.\n- Image 2: character_identity; use only for that declared role.\n- Image 3: background_space; use only for that declared role.\nContinuity: screen direction right_to_left; state entering: 브람이 떨어진 편지를 집었다; state leaving: 브람이 편지를 감춘다, 테오가 빚이라는 말을 붙잡는다.\nLettering: leave visually quiet negative space in these regions: left 4%, top 4%, width 38%, height 20%; left 54%, top 3%, width 40%, height 25%. Generate no speech balloons, captions, or readable text.\nAvoid: speech bubbles, captions, readable text, watermark, signature, duplicate character, 읽을 수 있는 편지 내용, 현대 우편물, 과장된 빚 문구.",
  "references": [
    {
      "path": "visual-bible/characters/bram-waldhart-canonical-v1.png",
      "role": "character_identity",
      "index": 1
    },
    {
      "path": "visual-bible/characters/theo-waldhart-canonical-v4.png",
      "role": "character_identity",
      "index": 2
    },
    {
      "path": "visual-bible/backgrounds/walt-fort-dining-hall-v1.png",
      "role": "background_space",
      "index": 3
    }
  ],
  "request": {
    "size": "1536x2048",
    "quality": "high",
    "format": "png"
  },
  "output": {
    "path": "episodes/ep001/art/shot-015.png",
    "result_metadata_path": "episodes/ep001/art/shot-015.result.json"
  }
}
