{
  "schema_version": "1.0",
  "artifact_type": "render_task",
  "task_id": "ep001-shot-023",
  "source_brief": "episodes/ep001/briefs/shot-023.json",
  "source_hash": "6de2b771379d21224f4e055dd2539067aa1e39c183ad90ab0152ae34422c261d",
  "template_id": "webtoon-shot-v1",
  "provider": "codex",
  "operation": "edit",
  "prompt": "Create one finished original vertical-scroll webtoon art shot. Template: webtoon-shot-v1.\nPurpose: 빵 부스러기 한 점을 다시 보는 테오의 손끝에서, 다가올 급해빙을 굶주림의 문제로 번역한 첫 결심으로 1화를 끝낸다.\nCanvas: 1536x2048 pixels; keep a 6% safe margin.\nComposition and camera: extreme_close_up shot, top_down angle, portrait lens feel, camera position 식탁 위 테오 손끝 바로 위, movement push_in, focus on 검지와 엄지 사이에 남은 빵 부스러기 한 점. 상단에는 마지막 독백, 하단에는 긴 스크롤 여백으로 다음 화를 기다리게 한다\nSubjects:\n- theo-waldhart at left 20%, top 43%, width 50%, height 36%, foreground; pose 손가락 두 개로 부스러기 하나를 집은 손 클로즈업; expression 얼굴은 보이지 않음; gaze 프레임 밖; action 부스러기를 보며 손을 멈춘다. Preserve: 일곱 살에 맞는 작은 손, 푸른 회색 소매, 얼굴과 전신 없음.\nBackground: location walt-fort-dining-hall; 앞선 회상과 같은 어두운 참나무 식탁 위, 흩어진 부스러기와 아주 얕은 수프 김. Use source crop left 28%, top 48%, width 45%, height 28%; perspective 안정된 탑뷰, 부스러기 한 점을 화면 중심으로; depth layers: 테오의 작은 손, 빵 부스러기, 짙은 목재 결; lighting 식당의 낮고 평범한 따뜻함, 극적인 광원 없음.\nVisual treatment: line 손끝과 작은 부스러기에 가장 높은 선명도; color 짙은 목재 갈색·따뜻한 베이지·푸른 회색 소매; rendering 절제된 깨끗한 2D 클로즈업; mood 조용하지만 되돌릴 수 없는 결심.\nReferences, in authoritative input order:\n- Image 1: character_identity; use only for that declared role.\n- Image 2: background_space; use only for that declared role.\nContinuity: screen direction neutral; state entering: 브람이 지휘하고 카일은 출발 준비를 한다, 테오는 식탁에 남아 있다; state leaving: 테오는 급해빙을 식량 위기의 시작으로 해석한다, 다음 화에서 곡물창과 빚 문서를 확인할 결심이 남는다.\nLettering: leave visually quiet negative space in these regions: left 22%, top 3%, width 50%, height 28%. Generate no speech balloons, captions, or readable text.\nAvoid: speech bubbles, captions, readable text, watermark, signature, duplicate character, 마법 효과, 성인 손, 얼굴, 과장된 불길, 읽을 수 있는 글자.",
  "references": [
    {
      "path": "visual-bible/characters/theo-waldhart-canonical-v4.png",
      "role": "character_identity",
      "index": 1
    },
    {
      "path": "visual-bible/backgrounds/walt-fort-dining-hall-v1.png",
      "role": "background_space",
      "index": 2
    }
  ],
  "request": {
    "size": "1536x2048",
    "quality": "high",
    "format": "png"
  },
  "output": {
    "path": "episodes/ep001/art/shot-023.png",
    "result_metadata_path": "episodes/ep001/art/shot-023.result.json"
  }
}
