{
  "schema_version": "1.0",
  "artifact_type": "render_task",
  "task_id": "ep001-shot-018",
  "source_brief": "episodes/ep001/briefs/shot-018.json",
  "source_hash": "515ca21d8ba2ea02dc36d10fdef502274446ac94cc503f7025db53efd05e1257",
  "template_id": "webtoon-shot-v1",
  "provider": "codex",
  "operation": "edit",
  "prompt": "Create one finished original vertical-scroll webtoon art shot. Template: webtoon-shot-v1.\nPurpose: 요새 창밖의 강·낡은 수문·습지·나루를 하나의 취약한 생활선으로 넓게 제시한다.\nCanvas: 1536x2048 pixels; keep a 5% safe margin.\nComposition and camera: extreme_wide shot, high angle, wide lens feel, camera position 월트 요새 돌창에서 동남쪽 강변을 내려다보며, movement tilt, focus on 구불거리는 마든 강과 낡은 수문, 갈대 습지, 안개 속 그레이포드 나루. 수문과 나루가 한 시선으로 이어지도록 물길을 화면 세로로 배치한다\nSubjects:\n- theo-waldhart at left 6%, top 68%, width 13%, height 22%, foreground; pose 창틀 한쪽에 선 작은 뒷모습; expression 얼굴은 보이지 않음; gaze 강 아래; action 풍경을 내려다본다. Preserve: 아주 작은 일곱 살 실루엣, 푸른 회색 튜닉, 어른 체격으로 확대하지 않음.\nBackground: location rowend-march; 마른 마든 강의 굽이, 진흙 제방, 기울어진 낡은 목제 수문, 갈대 습지, 멀리 안개 속 그레이포드 나루가 이어진 초해빙 전경. Use source crop left 0%, top 8%, width 100%, height 72%; perspective 높은 창에서 아래 강을 내려다보는 완만한 세로 원근; depth layers: 돌창과 테오 실루엣, 제방·수문·강, 갈대 습지·안개 속 나루·낮은 하늘; lighting 흐리고 차가운 해빙기 낮빛, 과장된 안개나 역광 없음.\nVisual treatment: line 가까운 돌창은 명료하게, 먼 풍경은 단순한 선으로; color 청회색·갈대색·진흙 갈색; rendering 정제된 2D 환경 원근; mood 작은 영지가 안고 있는 넓은 취약함.\nReferences, in authoritative input order:\n- Image 1: character_identity; use only for that declared role.\nContinuity: screen direction left_to_right; state entering: 테오가 창턱에 손을 올렸다; state leaving: 강·수문·제방·나루가 연결된 취약점으로 제시된다.\nLettering: generate no speech balloons, captions, or readable text.\nAvoid: speech bubbles, captions, readable text, watermark, signature, duplicate character, 대도시 전경, 판타지 성채, 폭풍·홍수의 확정 연출, 읽을 수 있는 표지판.",
  "references": [
    {
      "path": "visual-bible/characters/theo-waldhart-canonical-v4.png",
      "role": "character_identity",
      "index": 1
    }
  ],
  "request": {
    "size": "1536x2048",
    "quality": "high",
    "format": "png"
  },
  "output": {
    "path": "episodes/ep001/art/shot-018.png",
    "result_metadata_path": "episodes/ep001/art/shot-018.result.json"
  }
}
