{
  "schema_version": "1.0",
  "artifact_type": "render_task",
  "task_id": "ep001-shot-026",
  "source_brief": "episodes/ep001/briefs/shot-026.json",
  "source_hash": "39680b5db89d7d453b62dacf6d164057b0fbf4b6468dffe5b71f004760cb9727",
  "template_id": "webtoon-shot-v1",
  "provider": "codex",
  "operation": "edit",
  "prompt": "Create one finished original vertical-scroll webtoon art shot. Template: webtoon-shot-v1.\nPurpose: 형제의 웃음이 멎은 뒤에도 남은 식사의 온기가 어머니의 흐린 초상으로 이어져, 테오의 새 가족에 대한 감정을 과장 없이 만든다.\nCanvas: 1536x3072 pixels; keep a 5% safe margin.\nComposition and camera: medium_close_up shot, over_shoulder angle, portrait lens feel, camera position 식탁의 그릇 위에서 테오의 어깨 너머 벽 초상으로 천천히 이어진다, movement push_in, focus on 사라지는 웃음의 흔적에서 테오의 조용한 시선으로 이동. 두 개의 전폭 세로 패널과 가는 흰 여백, 하단 초상은 작게 유지\nBridge composition: this single generated image contains exactly 2 connected full-width mini-panels stacked vertically, separated by clean gutters. Read them top-to-bottom as one continuous transition, not as duplicate variants of the same pose.\nCanvas rule: preserve the declared 1:2 tall composite canvas with 2 equal-height full-width panels. Do not collapse it into one undivided scene or a differently proportioned strip.\nBridge function: emotional_breath. Ordered micro-beats: panel 1: 웃음이 멎은 식탁 위에서 국물 표면의 작은 물결과 아직 움직이는 카일의 소매 끝이 고요해진다.; panel 2: 테오가 고개를 들고 남쪽 벽의 흐린 타원 초상을 바라보며, 식탁의 온기 속 빈자리를 처음 의식한다..\nSubjects:\n- theo-waldhart at left 18%, top 52%, width 34%, height 40%, midground; pose 하단 패널에서 식탁에 앉은 채 고개만 천천히 남쪽 벽으로 든다; expression 웃음 뒤에 남은 조용한 생각; gaze 흐린 타원 초상; action 숟가락을 잠시 멈춘다. Preserve: 일곱 살의 둥근 얼굴 비율, 헝클어진 밤갈색 머리, 푸른 회색 튜닉과 세 잎 문장, 눈물과 과장된 비장함 금지.\nBackground: location walt-fort-dining-hall; 상단은 국그릇·빵·카일의 푸른 소매가 보이는 식탁 접사, 하단은 테오와 남쪽 벽의 작은 흐린 타원 초상이다.. Use source crop left 12%, top 16%, width 76%, height 72%; perspective 식탁의 원형 그릇에서 타원 초상으로 형태가 이어지는 얕은 대각선; depth layers: 식탁과 국그릇, 테오의 옆얼굴, 작고 흐린 초상과 나무 벽; lighting 따뜻하지만 절제된 실내광, 초상에는 인물 식별이 불가능할 정도의 부드러운 흐림.\nVisual treatment: line 그릇의 잔물결과 테오의 눈선만 섬세하게 강조; color 따뜻한 목재와 무채색 푸른 회색의 낮은 대비; rendering 부드러운 2D 웹툰 채색, 초상은 의도적으로 식별 불가; mood 가족의 온기 안에서 비어 있는 자리를 느끼는 조용한 숨.\nReferences, in authoritative input order:\n- Image 1: character_identity; use only for that declared role.\n- Image 2: background_space; use only for that declared role.\nContinuity: screen direction left_to_right; state entering: 브람의 농담 뒤 가족의 짧은 웃음이 끝난 직후; state leaving: 테오가 벽 초상과 식당 밖의 바람을 의식한다.\nLettering: leave visually quiet negative space in these regions: left 51%, top 3%, width 41%, height 18%. Generate no speech balloons, captions, or readable text.\nAvoid: speech bubbles, captions, readable text, watermark, signature, duplicate character, 어머니의 구체적인 얼굴, 눈물, 멜로드라마, 말풍선, 읽을 수 있는 글자, 워터마크, 서명.",
  "references": [
    {
      "path": "visual-bible/characters/theo-waldhart-canonical-v4.png",
      "role": "character_identity",
      "index": 1
    },
    {
      "path": "visual-bible/backgrounds/walt-fort-dining-hall-v1.png",
      "role": "background_space",
      "index": 2
    }
  ],
  "request": {
    "size": "1536x3072",
    "quality": "high",
    "format": "png"
  },
  "output": {
    "path": "episodes/ep001/art/shot-026.png",
    "result_metadata_path": "episodes/ep001/art/shot-026.result.json"
  }
}
