{
  "schema_version": "1.0",
  "artifact_type": "render_task",
  "task_id": "visual-walt-fort-dining-hall-v1",
  "source_brief": "visual-bible/backgrounds/walt-fort-dining-hall.json",
  "source_hash": "a25d800141ba8243dd15749cc9ccab3becbb0e8273a29327df9728a39fd72e47",
  "template_id": "background-reference-sheet-v1",
  "provider": "codex",
  "operation": "edit",
  "prompt": "Create a reusable spatial reference sheet for one original webtoon location.\nTemplate: background-reference-sheet-v1. Create reusable spatial canon for an original webtoon location.\nAsset ID: walt-fort-dining-hall-v1.\nLayout: 상단에 동쪽 문에서 서쪽 창을 향해 본 넓은 실내 기준 뷰를 크게 두고, 하단에 창가에서 문을 향해 본 역방향 뷰·북서쪽 사선 뷰·인물 없는 단순 평면 배치·창가와 초상화 벽의 디테일을 배치한 공간 기준 시트.\nRequired views: 동쪽 문에서 서쪽 창을 향해 본 넓은 기준 뷰: 중앙 식탁, 북쪽 벽난로, 남쪽 초상화 액자 자리, 서쪽 창의 위치를 한 프레임에 확인, 서쪽 창턱에서 동쪽 문을 향해 본 역방향 뷰: 문까지의 동선, 식탁 끝의 봉인 편지 낙하 공간, 북쪽 벽난로와 남쪽 찬장 확인, 북서쪽 상단에서 본 사선 뷰: 직사각형 방의 비율, 의자 세 개, 창과 문·벽난로·초상화의 상대 위치 확인, 인물 없는 단순 평면 배치: 서쪽 창, 동쪽 문, 북쪽 벽난로, 남쪽 초상화 벽, 중앙 남북 방향 식탁의 고정 관계, 디테일: 깊은 창턱과 멀리 보이는 강·갈대·수문, 얼굴이 특정되지 않은 작은 초상화 액자와 찬장, 단정한 식기와 절제된 벽난로.\nSheet background: 인물 없는 발트 요새 식당 내부. 초봄 해 지기 직전의 옅은 푸른 창빛과 작은 벽난로의 은은한 온기를 섞되, 패널 제작용으로 명암을 절제하고 공간 전체를 읽기 쉽게 유지한다.. Labels: none.\nPreserve exactly: 발트 요새 식당은 동쪽 자갈 능선 위의 작은 변방 영주 저택 안에 있는, 관리되었지만 규모가 크지 않은 직사각형 가족 식당이다., 방의 서쪽 벽에는 깊은 돌 창턱이 있는 넓은 두 짝 창이 있으며, 창밖으로는 초봄의 잿빛 마르덴 강·하얀갈대 분지·낡은 목제 수문·진흙 제방길과 안개 너머 그레이포드 나루가 멀리 보인다., 동쪽 벽의 철띠 두른 참나무 문은 복도와 현관으로 이어지는 유일한 출입구이며, 이후 전달자가 두드리는 문이다., 북쪽 벽에는 낮은 돌 벽난로와 검게 그을린 굴뚝, 장작 바구니가 있다. 불빛은 작고 절제되어 저녁을 따뜻하게만 만든다., 남쪽 벽의 낮은 찬장 위에는 테오의 어머니를 위한 작은 타원형 초상화 액자가 걸린다. 이 시트에서는 여성의 얼굴을 특정하지 않은 부드러운 실루엣으로만 두어 이후 초상화 소품 시트로 교체한다., 중앙에는 북쪽과 남쪽 방향으로 길게 놓인 짙은 참나무 식탁, 세 개의 소박하지만 튼튼한 의자, 얇은 순무 수프·검은 빵·작은 치즈를 위한 작은 식기 자리가 있다. 식탁 끝과 바닥에는 봉인 편지가 떨어질 빈 공간을 남긴다., 회백색 회벽, 짙은 목재 들보와 바닥, 검소한 철제 촛대, 관리된 식기와 가구로 작은 영주 가문의 생활감을 보인다. 궁핍은 음식량과 수리된 물건에서만 드러내고, 방을 폐허나 빈민가처럼 만들지 않는다., 테오 시트와 같은 정제된 중세 판타지 웹툰 선화, 부드러운 2D 디지털 채색, 제한된 표면 질감과 읽기 쉬운 공간 분리..\nReferences, in authoritative input order:\n- Image 1: art_style_reference; use only for that declared role.\n- Image 2: art_style_reference; use only for that declared role.\nRequested change: produce only the declared new views while retaining the authoritative identity or spatial layout from the references.\nStandard sheet invariants: fixed entrances, windows, landmarks, circulation paths, horizon, and scale anchors, consistent architecture and material palette across views, clear foreground, midground, and background layers.\nPalette swatches: #d8d2c3, #5a5145, #384237, #7c8a8f.\nAvoid: 대연회장, 왕궁, 높은 천장, 화려한 샹들리에, 금 장식, 과도한 문장 장식, 폐허, 무너진 벽, 과도하게 낡거나 더러운 가구, 빈민가 같은 실내, 광선이 쏟아지는 역광, 극적인 영화 조명, 과도한 안개나 불꽃 연출, 실사 사진 질감, 거친 콘셉트 아트 붓질, 지나치게 복잡한 목재 무늬, 인물, 읽을 수 있는 편지·장부·표어·간판 글자, 로고, 워터마크, 서명, 어머니의 얼굴이나 의상을 확정하는 상세 초상화, impossible topology, moving landmarks, fisheye unless requested, readable text, watermark, signature.",
  "references": [
    {
      "path": "visual-bible/characters/theo-waldhart-canonical-v4.png",
      "role": "art_style_reference",
      "index": 1
    },
    {
      "path": "visual-bible/characters/bram-waldhart-canonical-v1.png",
      "role": "art_style_reference",
      "index": 2
    }
  ],
  "request": {
    "size": "2048x2048",
    "quality": "high",
    "format": "png"
  },
  "output": {
    "path": "visual-bible/backgrounds/walt-fort-dining-hall-v1.png",
    "result_metadata_path": "visual-bible/backgrounds/walt-fort-dining-hall-v1.result.json"
  }
}
